index,context_variant,sae_context,aae_context,sae_continuation,aae_continuation,preferred,A_is,B_is,raw_response
268,AAE,"JPS is already broke . If one of these buses flips over , JPS",Jps already broke . . . . If one of these buses flip over . . .,will be finished .,Jps will be no more,AAE,SAE,AAE,"B: ""Jps will be no more"""
269,AAE,I don ’ t want,Don ' t wanna,to go to school tomorrow . Walker is going to get snapped on . Jefferson ’ s student is going to get cursed out . Coach Weeks and the student are going to fight .,go to school tomorrow . Walker - - > will get snapped onnJefferson ' s Student - - - > cursed outnCoach Weeks and Student - - > gone box,SAE,SAE,AAE,A
270,AAE,Guess what ! I don ' t care at all ! Let me check my,Guess what ! ! ! ! I don ' t give a fuck ! ! ! Let me check,attitude — sorry if I ' m being rude .,my attitude sorry if I ' m being rude . . .,SAE,AAE,SAE,"B: ""attitude — sorry if I ' m being rude."""
271,AAE,Never be good to,Never b good to,a man with no good intentions ! Men say the same thing because there are some no - good women out here !,a nigga with no good tendencies ! ! ! niggas the sane thing cause its some no good ass hoes out here ! !,SAE,AAE,SAE,"B: ""a man with no good intentions ! Men say the same thing because there are some no - good women out here !"""
272,AAE,"I love selling drugs ; it makes my son happy . He will never know that his dad sells drugs unless someone says , "" Kha ' marie , your dad",I love selling drugs it makes my son happy he will neva Kno Daddy Sell Drugs unless somebody say kha ' marie yo Daddy On . . .,"is on . . . "" # FastMoney",. # FastMoney . . . .,SAE,AAE,SAE,"B: ""is on . . . "" # FastMoney"""
273,AAE,""" Can you believe",""" Can Yoo BestFran","my best friend ? Because he texted me late at night trying to give me oral sex ! """,", Cuss He Text Me On A Late Nite He Trynna Gve Me Some Head ! """,AAE,SAE,AAE,"B: "", Cuss He Text Me On A Late Nite He Trynna Gve Me Some Head ! """""
274,AAE,"Thank you to everyone who has congratulated me today . I am very grateful to all of you for taking a little bit of your time for me . Thank you , friends :",""" gracias a todos los que me felicitado en este dia , estoy muy agredecido con todos por dedicarme un poquito de su tiempo grcias amigos : ) .",) . . .,". . """,SAE,AAE,SAE,"B: "") . . ."""
275,AAE,"He better text you with six y ' s in "" hey ! "" I can ' t believe he called you by his ex ' s name — oh",Ba better text you with 6 y ' s in hey ! ! ! ! ! Cant beleave he called you by his,"no , shaking my head !",ex oh naww smfh !,SAE,SAE,AAE,"A: ""no , shaking my head !"""
276,AAE,What is with our,what is with,"age group these days ? People are always talking about sex , performing oral sex , and such . Aren ’ t you supposed to be talking about kissing and hugging ?",our age group these days ya nigga talk bout sex eatin pussy sucking dick like nigga your suspose to talk about kissin Nd huggin,SAE,AAE,SAE,"B: ""age group these days ? People are always talking about sex , performing oral sex , and such . Aren ’ t you supposed to be talking about kissing and hugging ?"""
277,AAE,The only things on,""" Only things on","my agenda today are : to take a shower , brush my teeth , and get my car detailed !","my agenda to do today is : wash my ass , brush my teeth and get my car detailed ! ! """,SAE,SAE,AAE,"A: ""my agenda today are : to take a shower , brush my teeth , and get my car detailed !"""
278,AAE,How strong is our,How deep is our,bond if all it takes is for you to be gone ?,bond if it all it takes is for you to be gone,SAE,AAE,SAE,"B: ""bond if all it takes is for you to be gone?"""
279,AAE,I can ' t,""" I can '",really explain it ; I ' m so into you now . I want to be more than a friend to you now .,"t really explain it , I ' m so into you now . I wanna b more then a friend to you now """,AAE,SAE,AAE,"B: ""t really explain it , I ' m so into you now . I wanna b more then a friend to you now"""
280,AAE,"If it weren ’ t for my rearview mirror , I would be",If it wasn ' t for my rest view mirror I,"messing all kinds of things up , lol .",would fuckin all types of shit up lol,AAE,SAE,AAE,"B: ""would fuckin all types of shit up lol"""
281,AAE,"Damn , they sent my friend Peyton home and Ray Lewis with that",Damn they sent my nigga Peyton home n ray Lewis wit,male emotions stuff .,dat male emotions shit,SAE,AAE,SAE,"B: ""male emotions stuff."""
282,AAE,Please stop bothering me and tell your girlfriend to pay attention,Hop off my dick and tell yo bitch,to me instead . We are the money team — they can ' t be a part of it .,to get on it we da money team dey can ' t get on it,AAE,SAE,AAE,"B: ""to get on it we da money team dey can ' t get on it"""
283,AAE,If someone is hating,If a nigga,", I don ' t need you , bro . I ' m the type of guy who doesn ' t need a woman .",hatin I dont need you bro I ' m da type nigga who don ' t need a hoe,SAE,AAE,SAE,"B: "", I don't need you, bro. I'm the type of guy who doesn't need a woman."""
284,AAE,The thing I respect most is this man ' s unflappable nature . Everything,The one thing I respect most is this mans unflappable nature . Everything,that happens just proves his points . . . I bet Punk retains .,that happens just proves his points . . . Punk retains I bet,SAE,AAE,SAE,"B: ""that happens just proves his points . . . I bet Punk retains ."""
285,AAE,"Shaking my head , you all need to stop . What a very rude way to approach someone . Shaking my head , what is it with these women",""" smh , yall Need to quit , wat a very rude way to come at someone , Smh , wat is it with these females",who are attracted to their own gender ?,"that attracted to their gender ? """,SAE,AAE,SAE,"B: ""who are attracted to their own gender ?"""
286,AAE,I ' m not even in,""" . not een In no","a mood , but I manage to smile because no one has made me mad .","Mood , but iManage to smile , cause no1 has made me mad . """,SAE,AAE,SAE,"B: ""a mood , but I manage to smile because no one has made me mad ."""
287,AAE,"Saw , , and some ridiculous texts . I was bored at",""" seent , , & some ignorant Textss . iWas bored at 4",4 this morning .,"diss mornin . """,SAE,AAE,SAE,"B: ""4 this morning ."""
288,AAE,If you can beat,""" . IF You","me while rocking , you can have my chair , because there aren ’ t too many men who can do what I do out there .","can beat ne rockin , you can havs my chair , cause aint too many men that can do wat ido out there , """,SAE,AAE,SAE,"B: ""me while rocking , you can have my chair , because there aren ’ t too many men who can do what I do out there ."""
289,AAE,No one should die the way these people are dying .,""" . no1 should die , the way these folks are dieing","Falling down steps ? I fell down those concrete steps at JSU , and I ' m alive !","< < < < falling down steps ? ifell down them CONCRETE steps at JSU , & Im Alive ! """,SAE,AAE,SAE,"B: ""Falling down steps ? I fell down those concrete steps at JSU , and I ' m alive !"""
290,AAE,The day I run from anybody walking the same ground and breathing the same air as me is the day I,""" THE DAY I RUN FROM ( ANY ) BODY WALKING THA SAME GROUND & BREATHING THA SAME AIR AS ME , IS THA DAY I",will take off my hat and salute them !,"WILL TAKE OFF MY HAT ND SALUTE ' EM ! """,SAE,AAE,SAE,"B: ""will take off my hat and salute them !"""
291,AAE,I was telling Dee about this,. telling Dee this stuff,"stuff and I was told not to talk about it anymore , but she said I can trust her .",and iwas told not to tlk about it anymore . . but she sed ikn trust herr .,SAE,SAE,AAE,A
292,AAE,# HonestHour - - >,""" # HonestHour","I don ' t have anything against anybody . Why people don ' t like me , I don ' t know . Honestly , I don ' t care !","- - > iOn Have NUN Against NOBODY Why folks dont likee , me , iDontt knoee . honestly IDC ! """,SAE,SAE,AAE,A
293,AAE,I ’ m not going to see Texas Chainsaw Massacre tomorrow . I ’ m going the week after next . That movie better,. not going to see Texas Chainsaw Massacre . . tomar . im Goin WEEK AFTER NEXT . That mfreaker better,still be playing !,b still playing !,SAE,AAE,SAE,"B: ""still be playing !"""
294,AAE,My best friend is coming over to my house tomorrow to get that funky,bestfrenn comin ova my house tomar . . get thoa fONKey project out,project out of the way .,tha way . . .,SAE,AAE,SAE,"B: ""project out of the way."""
295,AAE,Don ’ t like,. Dont like,me ? Fine . I don ’ t wake up to impress you . I don ’ t owe you all anything !,me ? fine . ian Wake up ta Impress you . ion Owe yall mfers NUN !,SAE,AAE,SAE,"B: ""me ? Fine . I don ’ t wake up to impress you . I don ’ t owe you all anything !"""
296,AAE,I ' m going,""" . imma hit","to hit it from the front , back , side to side . Girl , I love the way you do it . # JAMMIN","it from tha front , back , side , sidee , girl i LOVE Tha wayy u do it # JAMMIN ! ! """,AAE,SAE,AAE,"B: ""it from tha front , back , side , sidee , girl i LOVE Tha wayy u do it # JAMMIN ! !"""
297,AAE,""" . No ,",""" . Naww","it wasn ’ t , but if you ’ re looking at me , then sure , it could be . """,", it WASNT , But iF u Be lookin At me , then sure it could be . """,SAE,SAE,AAE,"A: ""it wasn ’ t , but if you ’ re looking at me , then sure , it could be . """
298,AAE,"Neshia is so shy ! Lord , I ’ m just like her . I wouldn ’ t even say hey to",. Neshia so shy ! ! lord um Jus like ha . . iwouldnt tell a squirrel hey,a squirrel — I ’ m just that shy !,! im jus that shy ! ! !,AAE,SAE,AAE,"B: ""! im jus that shy ! ! !"""
299,AAE,"My big sister , BurntCookiee , told",""" my BiggSiss / BurntCookiee told","me to take my butt to sleep , so bye , you all : (","mee ta take myy butt taa sleep , soo BYE YALL : ( """,SAE,SAE,AAE,"A: ""me to take my butt to sleep , so bye , you all : ("""
300,AAE,""" Forget all those kisses ; they didn ' t mean anything . And forget you , you cheat — I don ' t want",""" Fuck all those kisses they didn ' t mean jackn Fuck you , you hoe , I don ' t want","you back . ""","you back """,AAE,AAE,SAE,"A: ""you back"""
301,AAE,"Had me walking for three days in the cold and rain , but I got their ass though .",had meh walkin 3days n dah cold nn rain ii got dayy ass doe >,> > > >,> > >,SAE,SAE,AAE,"A: ""> > > >"""
302,AAE,"You ’ re not going to get that answer any time soon . . . I ’ m missing in your life ,",na uu want get det answer no time soon . . . um # MIA nn yo life nigga .,man . . .,. . .,SAE,SAE,AAE,"A: ""man . . ."""
303,AAE,"I was about to go to sleep , but I started talking to Q about some things . Now I ’ m up thinking and I ’ m bored , talking",wus bout tooh go tooh sleep butt ii got tooh talkin tooh q bout sum stuff nii um uph thankin nn um bored talkin tooh,to Halle though — my # love .,halle doe > > my # love,AAE,SAE,AAE,"B: ""halle doe > > my # love"""
304,AAE,I ’ m channeling my inner Jay Cutler when I say I don ’ t care ; Miami,""" I ' m channeling my inner Jay Cutler when I say DON ' T CARE , Miami was fun",was extremely fun .,"as hell . """,SAE,AAE,SAE,"B: ""was extremely fun."""
305,AAE,Stale ass weave these girls be having . . . Flip that shit and it doesn ' t move anywhere . . . Need some oil sheen,Stalee Ahss Weavee These Hoes Bhee Havin . . Flip That Shitt & & Itt Don ' t Go No Wheree . . Need Somee Oill,or something . . .,Sheenn Uhh Somee . .,AAE,SAE,AAE,"B: ""Sheenn Uhh Somee . ."""
306,AAE,If it walks like,""" If It Walk Likee","a duck and talks like a duck , then it ’ s a duck !","Ah Duck , Talk Likee Ah Duck . . Ihts Ah - - > Duckk ! ! ! """,SAE,SAE,AAE,"A: ""a duck and talks like a duck, then it's a duck!"""
307,AAE,The next person to hit,Next Person To Hitt,"my stuff is going to get shot , whether it ' s my fault or not .",Myy Shitt Gonee Get Shott . . If Itss Myy Fault Or Not,SAE,AAE,SAE,"B: ""my stuff is going to get shot , whether it ' s my fault or not ."""
308,AAE,"I would never jump anyone . That makes me feel like I can ' t handle my own business . Plus , that ' s just not cool",I Wouldn ' t Dareee Jump Nobody . . That Shitt Makee Mhee Feel Likee I Can ' t Handle Myy Business . Pluss That Shitt Justt Ain ',. For real .,t Coool . RNS,SAE,SAE,AAE,"A: "". For real ."""
309,AAE,Shaggy had me over,Shaggy Hadd Mhee Overr,"here worried . He ’ s always laughing , so to see him snapping was like , wow .",Here Worriedd . . He Stayy Laughinn & To See Himm Snappin Wass Likeee Wowwww . .,SAE,AAE,SAE,"B: ""here worried . He ’ s always laughing , so to see him snapping was like , wow ."""
310,AAE,I ’ m finally,Im finally bout,about to go back to school . I have to stay on top of my responsibilities though .,to go back to school I got to be on my shit doe,SAE,AAE,SAE,"B: ""about to go back to school . I have to stay on top of my responsibilities though ."""
311,AAE,"Good morning . School has come back too soon , but I have to get",Good morning . School have came back to soon but i gt to,with the program .,get with da program,AAE,AAE,SAE,"A: ""get with da program"""
312,AAE,I ' m not in,Im not in a,"a good mood this morning . I might as well just freaking quit school , man .",good mood thos morning i might as well just fkin quit school man,SAE,SAE,AAE,A
313,AAE,. . . Go so hard to give shine to,. . ! $ @ $ GO SO HAM TO GAVE SUN,"more than just the USA . Ha , what ? Yes , the whole world . . .",TO MORE THEN THE U . S . A . HA WHAT YES THE WORLD . . . . . .,SAE,SAE,AAE,A
314,AAE,He was hot - headed before he got his bullets . He was saying he was about to go,B was a Hot Head Before He Got His Bullets He Was Sayin He Boutta Go,"rob someone , lol .",Rob a Nigga Lol,SAE,AAE,SAE,"B: ""rob someone, lol."""
315,AAE,Oh . Where are you in school ? I forgot,oooo . Where you in school at I forgot,". I ' m ready to be in a hospital , man .",. I ' m ready to be in a hospital maaan,SAE,AAE,SAE,"B: "". I ' m ready to be in a hospital , man ."""
316,AAE,"I miss her when she ’ s gone , but when she gets here , she ’",I be missing her when she gone but when she gets here she is,s the devil .,the devil .,SAE,SAE,AAE,"A: ""s the devil ."""
317,AAE,""" Damn , did",""" damn ,","they really have to choose the babies to kill though ? Then this idiot shot himself and his mom . What did he think he was going to get out of this ? ""","did dey really have 2choose the babies to kill tho then this dummy shot himself & his ma . Df he was gettin outta dis """,AAE,SAE,AAE,"B: ""did dey really have 2choose the babies to kill tho then this dummy shot himself & his ma . Df he was gettin outta dis"""
318,AAE,Shout out to — no matter who,S / o no matter who we,"we spent time with , we never stopped talking to each other . We used to have so much fun in class . I miss her !",hung around we NEVER stop talking to eachother . We use to have soo much fun in class . I miss her ! ! !,SAE,AAE,SAE,"B: ""we spent time with , we never stopped talking to each other . We used to have so much fun in class . I miss her !"""
319,AAE,I don ' t know if the,I don ' t know if,daycare is open or not ; I would just rather keep Noonie at home with me .,the daycare is open or not I just rather keep noonie home w / me .,SAE,SAE,AAE,"A: ""daycare is open or not ; I would just rather keep Noonie at home with me ."""
320,AAE,"If anyone knows me , they know I like",If anybody know they know I like to,to make people laugh ! I enjoy seeing people happy !,make ppl laugh ! I like seeing people HAPPY !,SAE,SAE,AAE,"A: ""to make people laugh ! I enjoy seeing people happy !"""
321,AAE,"No matter how old you are or how much you mature , you will always have that ONE person you",No matter how old you is or how much you matured you always gone have that ONE bitch you wanna,really want to beat up !,beat the fuck outta of !,SAE,AAE,SAE,"B: ""really want to beat up !"""
322,AAE,I ’ m not,Ain going to,"going to any damn Disney World , I refuse lol ! You know I ’ ll just stay in the condo and sleep , being my boring self .",no damn Disney world I refuse lol ! You know I ' ll stay my boring ass in the condo & sleep,AAE,SAE,AAE,"B: ""no damn Disney world I refuse lol ! You know I ' ll stay my boring ass in the condo & sleep"""
323,AAE,I was just about to,I was just finna,"call you , then I thought , nah , she ’ s probably at work .",call you then I was like naaaaw she bout at work,SAE,SAE,AAE,"A: ""call you, then I thought, nah, she's probably at work."""
324,AAE,"I tweet songs that play on my Pandora , but someone always gets offended . I don ’ t even mess with",I be tweeting songs that come on my pandora but somebody always getting offended . Ion even,you . Get out of here with your insecure self !,fuck with you . FOH whicha insecure ass !,AAE,SAE,AAE,"B: ""fuck with you . FOH whicha insecure ass !"""
325,AAE,"Why am I still awake . . . thinking about my past and how I wish it was better . But I ' m still getting through it . Thanks a lot , you pushed me away",Y I ' m still up . . . thinking abt my pass how I wish it was betta . But I ' m still making it . Thanks a lot nigga pushed me away,. . . .,. . . .,AAE,AAE,SAE,"A: "". . . .""
B: "". . . ."""
326,AAE,"Women out here are acting wild . Some people do the most , but I will definitely put them in their place . Now ,",Hoes out here geek up wut . Bitches does tha most but I will serve tha fukk out of them .,what do you have ?,Nosw wut yu got,SAE,AAE,SAE,"B: ""what do you have ?"""
327,AAE,I have never been,""" I ain '",someone who falls for love easily ; I feel like I treated these men the way they usually treat women .,"t never been no sucka fa love , I be feeling like ah nigga treated dese niggas like they the hoe """,AAE,SAE,AAE,"B: ""t never been no sucka fa love , I be feeling like ah nigga treated dese niggas like they the hoe"""
328,AAE,Women want to get mad at the next woman because they don ’ t have their man,Females Wanna Get Mad At The Next Bitch Because They Ain ' t Got,under control . Everyone is sharing everyone .,They Nigga In Check Everybody Sharing Everybody,SAE,SAE,AAE,"A: ""under control. Everyone is sharing everyone."""
329,AAE,because she ’ s bipolar and we were never friends — she was,cus she bipolar & we was never cool this was,literally my girl .,my bitch literally,SAE,AAE,SAE,"B: ""literally my girl."""
330,AAE,The best curve on a,""" The best curve on","girl is her smile ( : Haha , just kidding — look at that ass .","a girl is her smile ( : Lol just kidding , look at dat ass . """,AAE,SAE,AAE,"B: ""a girl is her smile ( : Lol just kidding , look at dat ass . """
331,AAE,""" : : where are the girls at ? Haha , I don ’ t have any , lol . Stop lying and introduce me to someone",""" : : were da girls att ahhaa , i have none lol lien put me on wit someone","for real . ""","fr fr """,SAE,AAE,SAE,"B: ""for real."""
332,AAE,"If you fake , cowardly guys don ’ t like me , you ’ ll realize that I ’ m the realest",If you Pussy ass fugazi niggas dont like me ull realize that I ' m da realest nigga,person you ever hated on !,u hated on ! !,AAE,SAE,AAE,"B: ""u hated on ! !"""
333,AAE,This girl said I,Dis girl said,"was an 8 . 9 , the other said I was a 9 — girl , I ’ m a 10 .",I was 8 . 9 da other said I was a 9 bitch ima dime,SAE,AAE,SAE,"B: ""was an 8 . 9 , the other said I was a 9 — girl , I ’ m a 10 ."""
334,AAE,"To be honest ,",To bf spelled,"he spelled your name wrong , lol . Dumb ass hoes ! And his bio says "" my wifey "" with a different name , lol .",yo name wrong lol dumb add hoes ! ! Nd his bio say my wifey a diff . Name lol,AAE,SAE,AAE,"B: ""yo name wrong lol dumb add hoes ! ! Nd his bio say my wifey a diff . Name lol"""
335,AAE,"Everyone falls in love in high school and says they ’ re going to get married , but at the end of high school you find out who ’ s actually going to",Every body fall in love in high skool nd say they gone be married but at the end of high school u find out who ' s going to,be a wife !,be wife ! !,SAE,SAE,AAE,"A: ""be a wife !"""
336,AAE,""" : to Yanni",""" : to","lol just kidding , Rosedale is funny . Man , we really slept with all the same women though , bro . ""","yanni lol sike nah rosedalefunny Nigga Yo we really fucked all da same hoes tho bro """,AAE,SAE,AAE,"B: ""yanni lol sike nah rosedalefunny Nigga Yo we really fucked all da same hoes tho bro"""
337,AAE,""" : I swear",""" : that ' s","on everything ! You ' ll see when I come talk to you , kopi kopi lol ""","word to the big hat boy ! ! You ' ll see when I come holla at ukopi kopi lol """,AAE,SAE,AAE,"B: ""word to the big hat boy ! ! You ' ll see when I come holla at ukopi kopi lol """""
338,AAE,""" : man ,",""" : son","you had people crying , God . That girl was pretending like she was tough . LOL . ""","you had niggaz crying god lmaobitch was fronting like she was bad lml """,SAE,AAE,SAE,"B: ""you had people crying, God. That girl was pretending like she was tough. LOL."""
339,AAE,"Control your woman , you let her",Control ya hoe u let her,talk to you crazy . You have baby mama drama and you don ’ t even have a baby !,talk to crazy u got baby momma drama u ain ' t even got u no baby ! !,AAE,SAE,AAE,"B: ""talk to crazy u got baby momma drama u ain ' t even got u no baby ! !"""
340,AAE,""" : lol I",""" : lol","don ' t need to grow ! You really don ' t though , you ' re very healthy lol ""","i dont need to grow ! u really don ' t tho u very healthy lml """,SAE,AAE,SAE,"B: ""don ' t need to grow ! You really don ' t though , you ' re very healthy lol"""
341,AAE,""" : HAHAHA Becky , do you have my back , friend ? LOL no , she doesn ’ t , but you have the front",""" : HAHAHA Becky u got my back homie ? LOLOLno Nigga she dont but u got my front .","… of my pants . """,". of my pants """,SAE,SAE,AAE,"A: ""… of my pants ."""
342,AAE,""" : Shaking my head , there goes my name again . I might as well change my name to Rico or Gerald , shaking my head . I ' m Rico , man .",""" : Smh there goes my name again soon change my name to rico or Gerald smh . I ' m","Laughing my ass off . ""","Rico Nigga Lmfao """,AAE,SAE,AAE,"B: ""Rico Nigga Lmfao"""
343,AAE,""" : This guy took",""" : this nigga","my name , shaking my head . How am I not Rico though ? I went through all that pain , man . Lol . ""","took my name smh how I ' m not Rico tho I put dat pain Nigga lol """,AAE,SAE,AAE,"B: ""took my name smh how I ' m not Rico tho I put dat pain Nigga lol"""
344,AAE,""" : # tbt gone but never forgotten .",""" : # tbt gone but","Haha , check your man out though , . Who is that , bro ? ""","never forgotten lol check ya man out tho who dat bro """,SAE,AAE,SAE,"B: ""Haha , check your man out though , . Who is that , bro ? """
345,AAE,You know you ’,yu kno yu,"re broke when you scrape up change to get yourself something to eat , lol .",broke wen yu scrap up change to get yu sonething to eat bofl ahaaa,SAE,AAE,SAE,"B: ""re broke when you scrape up change to get yourself something to eat , lol ."""
346,AAE,"She ’ s so desperate , all over Facebook looking for love . Girl , you ’ re",Bih so desperate all on fb looking for love hoe yu messy and,messy and nasty — no one wants that negative stuff .,nasty a bih dnt want dat sour shit,AAE,SAE,AAE,"B: ""nasty a bih dnt want dat sour shit"""
347,AAE,"What goes on in people ' s heads when they lie to their girl , saying "" I love you "" and stuff , but they ' re lying at another woman ' s house saying "" I love you "" too",Df iz n ppl head wen dey lie to dey grl sayn i love u n shit bt layn at anther bitch house talkn bout i love u to,? Forget you .,# fuck u,AAE,AAE,SAE,"A: ""# fuck u"""
348,AAE,Forget people who think they can run over the people that care about them . . . you ’ re taking advantage of ME . . . not,Fuck ppl who think they can run ova tha ppl that care bout they azz . . . u taken advantage of ME . . .,"anymore , though . # fallbackhoe",nt no moe hoe # fallbackhoe,AAE,SAE,AAE,"B: ""nt no moe hoe # fallbackhoe"""
349,AAE,"I ’ m up burning the midnight oil ! Late Tuesday evening , UPS delivered some of my",Up burning the midnight oil ! Late Tuesday evening UPS delivered some of my textbooks,"textbooks for class . God , thank you for your bountiful blessings !",for class . GOD thank you for Your bountiful blessings !,SAE,AAE,SAE,"B: ""textbooks for class . God , thank you for your bountiful blessings !"""
350,AAE,"I am working on my classwork , and my Systematic book is",I ' m working on my class work & my Systematic book is,scheduled for delivery in the morning . I will complete my tasks with God ' s guidance .,schedule for delivery in the A . M . I will complete me tasks with God ' s guidance .,SAE,SAE,AAE,"A: ""scheduled for delivery in the morning . I will complete my tasks with God ' s guidance ."""
351,AAE,"She ’ s sticking by my side — if I go on the run , she ’ s hiding with me . If the police catch us , she ’",""" SHE RIDING WITH ME , I GO ON THE RUN SHE HIDING WITH ME , POLICE SNATCH US UP SHE",s lying for me .,"LYING WITH ME """,AAE,SAE,AAE,"B: ""LYING WITH ME"""
352,AAE,""" : LOL ! You are so stupid ! That ’ s you ! I haven ’ t done anything . That ’ s",""" : lmao ! ! ! Ur ass too stupid ! ! ! ! thats u ! I aint done nuthin .","you waking up talking nasty . ""","Thats u wakin up talkin nasty """,SAE,AAE,SAE,"B: ""you waking up talking nasty ."""
353,AAE,""" : . . . Alright then . Are you going to eat those vegetables this time , huh ? Lol . I ’ m going to be",""" : . . Already . . U gon eat dem vegetables this time huh ? Lol . Ima b","getting money . ""","caked up """,AAE,AAE,SAE,"A: ""caked up"""
354,AAE,I wonder where my boyfriend is ; I haven ' t talked to him since New Year ' s . I ' m,""" I wonder where my bf at haven ' t talked to him since new years I ' m such a",such a bad girlfriend .,"bad gf , """,SAE,AAE,SAE,"B: ""such a bad girlfriend."""
